{
  "Source": "https://api.nuget.org/v3/index.json",
  "License": {
    "Code": "MIT",
    "Status": "AutomaticallyApproved"
  },
  "UsedBy": [
    {
      "Name": "ThirdPartyLibraries",
      "InternalOnly": true,
      "TargetFrameworks": [
        "net6.0",
        "net7.0",
        "net8.0"
      ],
      "Dependencies": [
        {
          "Name": "Microsoft.TestPlatform.ObjectModel",
          "Version": "17.9.0"
        },
        {
          "Name": "Newtonsoft.Json",
          "Version": "13.0.3"
        }
      ]
    }
  ],
  "Licenses": [
    {
      "Subject": "package",
      "Code": "MIT",
      "HRef": "LICENSE_MIT.txt",
      "Description": "The license file is identical to the repository license file."
    },
    {
      "Subject": "repository",
      "Code": "MIT",
      "HRef": "https://github.com/microsoft/vstest"
    },
    {
      "Subject": "project",
      "Code": "MIT",
      "HRef": "https://github.com/microsoft/vstest"
    }
  ]
}