{
  "$schema": "https://raw.githubusercontent.com/max-ieremenko/ThirdPartyLibraries/refs/heads/master/Docs/schema.package-index.json",
  "Source": "https://api.nuget.org/v3/index.json",
  "License": {
    "Code": "MIT",
    "Status": "AutomaticallyApproved"
  },
  "UsedBy": [
    {
      "Name": "ThirdPartyLibraries",
      "InternalOnly": true,
      "TargetFrameworks": [
        "net10.0",
        "net8.0",
        "net9.0"
      ],
      "Dependencies": [
        {
          "Name": "Microsoft.TestPlatform.ObjectModel",
          "Version": "18.5.1"
        },
        {
          "Name": "Newtonsoft.Json",
          "Version": "13.0.3"
        }
      ]
    }
  ],
  "Licenses": [
    {
      "Subject": "package",
      "Code": "MIT",
      "HRef": "https://licenses.nuget.org/MIT"
    },
    {
      "Subject": "repository",
      "Code": "MIT",
      "HRef": "https://github.com/microsoft/vstest"
    },
    {
      "Subject": "project",
      "Code": "MIT",
      "HRef": "https://github.com/microsoft/vstest"
    }
  ]
}