{
  "Source": "https://api.nuget.org/v3/index.json",
  "License": {
    "Code": "MIT",
    "Status": "AutomaticallyApproved"
  },
  "UsedBy": [
    {
      "Name": "ThirdPartyLibraries",
      "InternalOnly": true,
      "TargetFrameworks": [
        "net8.0",
        "net9.0"
      ]
    }
  ],
  "Licenses": [
    {
      "Subject": "package",
      "Code": "MIT",
      "HRef": "https://licenses.nuget.org/MIT"
    },
    {
      "Subject": "repository",
      "Code": "MIT",
      "HRef": "git://github.com/dotnet/runtime"
    },
    {
      "Subject": "project",
      "Code": "MIT",
      "HRef": "https://github.com/dotnet/runtime"
    }
  ]
}