{
  "$schema": "https://raw.githubusercontent.com/max-ieremenko/ThirdPartyLibraries/refs/heads/master/Docs/schema.package-index.json",
  "Source": "https://api.nuget.org/v3/index.json",
  "License": {
    "Code": "MIT",
    "Status": "AutomaticallyApproved"
  },
  "UsedBy": [
    {
      "Name": "ThirdPartyLibraries",
      "InternalOnly": false,
      "TargetFrameworks": [
        "netstandard2.1"
      ]
    }
  ],
  "Licenses": [
    {
      "Subject": "package",
      "Code": "MIT",
      "HRef": "https://github.com/PowerShell/PowerShell/blob/master/LICENSE.txt"
    },
    {
      "Subject": "project",
      "Code": "MIT",
      "HRef": "https://github.com/PowerShell/PowerShellStandard"
    }
  ]
}