{
  "Source": "https://api.nuget.org/v3/index.json",
  "License": {
    "Code": "MIT",
    "Status": "AutomaticallyApproved"
  },
  "UsedBy": [
    {
      "Name": "ThirdPartyLibraries",
      "InternalOnly": true,
      "TargetFrameworks": [
        "netstandard2.1"
      ]
    }
  ],
  "Licenses": [
    {
      "Subject": "package",
      "Code": "MIT",
      "HRef": "https://licenses.nuget.org/MIT"
    },
    {
      "Subject": "repository",
      "Code": "MIT",
      "HRef": "https://github.com/dotnet/maintenance-packages"
    },
    {
      "Subject": "project",
      "Code": "MIT",
      "HRef": "https://github.com/dotnet/maintenance-packages"
    }
  ]
}