{
  "Source": "https://api.nuget.org/v3/index.json",
  "License": {
    "Code": "MIT",
    "Status": "AutomaticallyApproved"
  },
  "UsedBy": [
    {
      "Name": "ThirdPartyLibraries",
      "InternalOnly": true,
      "TargetFrameworks": [
        "net8.0",
        "net9.0"
      ],
      "Dependencies": [
        {
          "Name": "Microsoft.ApplicationInsights",
          "Version": "2.22.0"
        },
        {
          "Name": "Microsoft.Testing.Platform",
          "Version": "1.5.3"
        }
      ]
    }
  ],
  "Licenses": [
    {
      "Subject": "package",
      "Code": "MIT",
      "HRef": "https://licenses.nuget.org/MIT"
    },
    {
      "Subject": "repository",
      "Code": "MIT",
      "HRef": "https://github.com/microsoft/testfx"
    },
    {
      "Subject": "project",
      "Code": "MIT",
      "HRef": "https://github.com/microsoft/testfx"
    }
  ]
}