{
  "$schema": "https://raw.githubusercontent.com/max-ieremenko/ThirdPartyLibraries/refs/heads/master/Docs/schema.package-index.json",
  "Source": "https://api.nuget.org/v3/index.json",
  "License": {
    "Code": "MIT",
    "Status": "AutomaticallyApproved"
  },
  "UsedBy": [
    {
      "Name": "ThirdPartyLibraries",
      "InternalOnly": true,
      "TargetFrameworks": [
        "net10.0",
        "net8.0",
        "net9.0",
        "netstandard2.1"
      ],
      "Dependencies": [
        {
          "Name": "System.IO.Hashing",
          "Version": "10.0.8"
        }
      ]
    }
  ],
  "Licenses": [
    {
      "Subject": "package",
      "Code": "MIT",
      "HRef": "https://licenses.nuget.org/MIT"
    },
    {
      "Subject": "repository",
      "Code": "MIT",
      "HRef": "https://github.com/dotnet/dotnet"
    },
    {
      "Subject": "project",
      "Code": "MIT",
      "HRef": "https://github.com/dotnet/dotnet"
    }
  ]
}