{
  "Source": "https://api.nuget.org/v3/index.json",
  "License": {
    "Code": "MIT",
    "Status": "AutomaticallyApproved"
  },
  "UsedBy": [
    {
      "Name": "ThirdPartyLibraries",
      "InternalOnly": true,
      "TargetFrameworks": [
        "netstandard2.1"
      ],
      "Dependencies": [
        {
          "Name": "System.Memory",
          "Version": "4.6.0"
        }
      ]
    }
  ],
  "Licenses": [
    {
      "Subject": "package",
      "Code": "MIT",
      "HRef": "https://licenses.nuget.org/MIT"
    },
    {
      "Subject": "repository",
      "Code": "MIT",
      "HRef": "https://github.com/SimonCropp/EmptyFiles.git"
    },
    {
      "Subject": "project",
      "Code": "MIT",
      "HRef": "https://github.com/SimonCropp/EmptyFiles"
    }
  ]
}