{
  "$schema": "https://raw.githubusercontent.com/max-ieremenko/ThirdPartyLibraries/refs/heads/master/Docs/schema.package-index.json",
  "Source": "https://api.nuget.org/v3/index.json",
  "License": {
    "Code": "MIT",
    "Status": "AutomaticallyApproved"
  },
  "UsedBy": [
    {
      "Name": "ThirdPartyLibraries",
      "InternalOnly": true,
      "TargetFrameworks": [
        "netstandard2.1"
      ],
      "Dependencies": [
        {
          "Name": "EmptyFiles",
          "Version": "4.4.0"
        },
        {
          "Name": "System.Management",
          "Version": "6.0.1"
        }
      ]
    }
  ],
  "Licenses": [
    {
      "Subject": "package",
      "Code": "MIT",
      "HRef": "https://licenses.nuget.org/MIT"
    },
    {
      "Subject": "repository",
      "Code": "MIT",
      "HRef": "https://github.com/VerifyTests/DiffEngine.git"
    },
    {
      "Subject": "project",
      "Code": "MIT",
      "HRef": "https://github.com/VerifyTests/DiffEngine"
    }
  ]
}